{
  "schema_version": 1,
  "repository": "xhan145/roar",
  "generated_at": "2026-08-06T12:00:00Z",
  "platforms": {
    "windows": {
      "available": true,
      "channel": "stable",
      "version": "0.35.2",
      "release_name": "ROAR v0.35.2 \u2014 installer honesty, continued",
      "published_at": "2026-08-03T19:20:31Z",
      "architecture": "x86_64",
      "package_type": "exe",
      "asset_name": "ROAR-Setup-0.35.2.exe",
      "asset_url": "https://github.com/xhan145/roar/releases/download/v0.35.2/ROAR-Setup-0.35.2.exe",
      "asset_size_bytes": 908794228,
      "sha256": "ed7180f00bd4a3c923c97eeb8b84c43f263b0fced9aa38d903489eed4ad768e3",
      "release_notes_url": "https://github.com/xhan145/roar/releases/tag/v0.35.2"
    },
    "linux": {
      "available": false,
      "channel": "preview"
    }
  }
}
